{
  "source_dir": "/srv/build/ctx/model-runtime",
  "revision": "bad876c",
  "versions": {
    "boundary": "v2.5.0",
    "model_runtime": "v0.10.0",
    "survey_schema": "v1.2.0"
  },
  "dependency_sources": {
    "boundary": "/srv/build/ctx/src/boundary-contracts-v2.5.0",
    "survey_schema": "/srv/build/ctx/src/survey-schema-v1.2.0/schema"
  },
  "variant": "gpu",
  "image_tag": "deploy-build/model-serving-gpu:bad876c"
}
